{
  "$schema": "http://json-schema.org/draft-04/schema#",
  "type": "object",
  "additionalProperties": false,
  "required": [
    "base_path",
    "format",
    "locale",
    "public_updated_at"
  ],
  "properties": {
    "base_path": {
      "$ref": "#/definitions/absolute_path"
    },
    "title": {
      "type": "string"
    },
    "description": {
      "type": "string"
    },
    "format": {
      "type": "string",
      "enum": [
        "topic"
      ]
    },
    "public_updated_at": {
      "type": "string",
      "format": "date-time"
    },
    "locale": {
      "type": "string"
    },
    "need_ids": {
      "type": "array",
      "items": {
        "type": "string"
      }
    },
    "details": {
      "type": "object",
      "additionalProperties": false,
      "properties": {
        "beta": {
          "anyOf": [
            {
              "type": "boolean"
            },
            {
              "type": "null"
            }
          ]
        },
        "groups": {
          "type": "array",
          "items": {
            "type": "object",
            "additionalProperties": false,
            "required": [
              "name",
              "contents"
            ],
            "properties": {
              "name": {
                "type": "string"
              },
              "contents": {
                "type": "array",
                "items": {
                  "type": "string"
                }
              }
            }
          }
        }
      }
    },
    "links": {
      "type": "object",
      "additionalProperties": false,
      "properties": {
        "parent": {
          "$ref": "#/definitions/frontend_links"
        },
        "children": {
          "$ref": "#/definitions/frontend_links"
        },
        "available_translations": {
          "$ref": "#/definitions/frontend_links"
        }
      }
    },
    "updated_at": {
      "type": "string",
      "format": "date-time"
    }
  },
  "definitions": {
    "absolute_path": {
      "type": "string",
      "pattern": "^/(([a-zA-Z0-9._~!$&'()*+,;=:@-]|%[0-9a-fA-F]{2})+(/([a-zA-Z0-9._~!$&'()*+,;=:@-]|%[0-9a-fA-F]{2})*)*)?$"
    },
    "route": {
      "type": "object",
      "additionalProperties": false,
      "required": [
        "path",
        "type"
      ],
      "properties": {
        "path": {
          "type": "string"
        },
        "type": {
          "enum": [
            "prefix",
            "exact"
          ]
        }
      }
    },
    "guid_list": {
      "type": "array",
      "items": {
        "pattern": "^[a-f0-9]{8}-[a-f0-9]{4}-[1-5][a-f0-9]{3}-[89ab][a-f0-9]{3}-[a-f0-9]{12}$"
      }
    },
    "frontend_links": {
      "type": "array",
      "items": {
        "type": "object",
        "additionalProperties": false,
        "required": [
          "title",
          "base_path",
          "locale"
        ],
        "properties": {
          "title": {
            "type": "string"
          },
          "description": {
            "type": "string"
          },
          "base_path": {
            "type": "string"
          },
          "api_url": {
            "type": "string",
            "format": "uri"
          },
          "web_url": {
            "type": "string",
            "format": "uri"
          },
          "locale": {
            "type": "string"
          }
        }
      }
    }
  }
}
