{
    "base_path": "/topic/oil-and-gas-beta",
    "description": "",
    "details": {
      "beta": true
    },
    "format": "topic",
    "links": {
      "children": []
    },
    "locale": "en",
    "need_ids": [],
    "public_updated_at": "2015-04-20T15:46:10.000+00:00",
    "title": "Oil and gas",
    "updated_at": "2015-04-20T15:50:11.000+00:00"
}
