{
    "base_path": "/topic/oil-and-gas/offshore",
    "description": "A page about offshore oil and gas",
    "details": {
      "groups": [
        {
          "name": "Oil rigs",
          "contents": [
            "/oil-rig-safety-requirements",
            "/oil-rig-staffing"
          ]
        },
        {
          "name": "Piping",
          "contents": [
            "/undersea-piping-restrictions"
          ]
        }
      ]
    },
    "format": "topic",
    "links": {
      "parent": [
        {
          "base_path": "/topic/oil-and-gas",
          "title": "Oil and gas",
          "api_url": "https://www.gov.uk/api/content/topic/oil-and-gas",
          "web_url": "https://www.gov.uk/topic/oil-and-gas",
          "locale": "en"
        }
      ]
    },
    "locale": "en",
    "need_ids": [],
    "public_updated_at": "2015-04-20T15:46:10.000+00:00",
    "title": "Offshore",
    "updated_at": "2015-04-20T15:50:11.000+00:00"
}
