{
    "base_path": "/topic/oil-and-gas/licensing",
    "description": "A page about oil and gas licensing",
    "details": {
    },
    "format": "topic",
    "links": {
      "parent": [
        {
          "base_path": "/topic/oil-and-gas",
          "title": "Oil and gas",
          "api_url": "https://www.gov.uk/api/content/topic/oil-and-gas",
          "web_url": "https://www.gov.uk/topic/oil-and-gas",
          "locale": "en"
        }
      ]
    },
    "locale": "en",
    "need_ids": [],
    "public_updated_at": "2015-04-20T15:46:10.000+00:00",
    "title": "Oil and gas: Licensing",
    "updated_at": "2015-04-20T15:50:11.000+00:00"
}
